type,title,location,site_visit_date,ROM,solicitationNumber,department,typeOfSetAsideDescription,responseDeadLine,postedDate,naicsCode,award,uiLink,baseType,archiveDate,organizationType,fullParentPathCode,active,fullParentPathName,Queried_NAICS,typeOfSetAside,additionalInfoLink,resourceLinks
Solicitation,BRVB - Entry Courtyard Improvements,"Topeka, Kansas",,,140P6026B0004,,Total Small Business Set-Aside (FAR 19.5),2026-07-01T12:00:00-05:00,2026-05-28,237310,,https://sam.gov/workspace/contract/opp/ef3589ed294848bbbd864dcfd237cf21/view,Sources Sought,2026-07-16,OFFICE,014.1443.140P60,Yes,"INTERIOR, DEPARTMENT OF THE.NATIONAL PARK SERVICE.MWR MIDWEST REGION(60000)",237310,SBA,,"['https://sam.gov/api/prod/opps/v3/opportunities/resources/files/27570a4316d54735a4767e2b3f1879a1/download', 'https://sam.gov/api/prod/opps/v3/opportunities/resources/files/28d781d68fec4407bc62f7de600fea43/download', 'https://sam.gov/api/prod/opps/v3/opportunities/resources/files/38ab58013a4844948308b1490995e89e/download', 'https://sam.gov/api/prod/opps/v3/opportunities/resources/files/5287706fb97d4ed998c4f1bda19d8bd3/download', 'https://sam.gov/api/prod/opps/v3/opportunities/resources/files/791cd643d5cb4bb8a823291e04402be7/download', 'https://sam.gov/api/prod/opps/v3/opportunities/resources/files/8330f9d7145f41b4b41c81a17c41b1de/download']"
Presolicitation,Various Fencing for Gate Perimeter Security - Sources Sought - Pre-Solicitation ,Not Specified,,,W91RUS26R7701,,Total Small Business Set-Aside (FAR 19.5),2026-05-26T12:00:00-07:00,2026-05-12,237990,,https://sam.gov/workspace/contract/opp/5cfb08d438ad480b9e3605f9b329309e/view,Presolicitation,2027-05-12,OFFICE,021.2100.AMC.ACC.ACC-CTRS.ACC-APG.W91RUS,Yes,DEPT OF DEFENSE.DEPT OF THE ARMY.AMC.ACC.ACC-CTRS.ACC-APG.W6QK ACC-APG CONT CT SW SECTOR,237990,SBA,,
Presolicitation,Z2LC--Campus Sinkhole Repair  552-26-506,"Dayton, Ohio",,"$500,000.00 and $1,000,000.00 | $500,000.00 | $1,000,000.00",36C25026B0045,,Service-Disabled Veteran-Owned Small Business Set Aside,2026-06-18T15:00:00-04:00,2026-05-14,237110,{'awardee': {}},https://sam.gov/workspace/contract/opp/6cc66252a2dc4c15bda3dd7f05767469/view,Presolicitation,2026-08-17,OFFICE,036.3600.36C250,Yes,"VETERANS AFFAIRS, DEPARTMENT OF.VETERANS AFFAIRS, DEPARTMENT OF.250-NETWORK CONTRACT OFFICE 10 (36C250)",237110,SDVOSBC,,['https://sam.gov/api/prod/opps/v3/opportunities/resources/files/60da70921290460ba75bd358560dcc2d/download']
Solicitation,FOMA REPLACE NATURE TRAIL BOARDWALK RS,Not Specified,,,140P5426R0010,,Women-Owned Small Business,2026-06-26T13:00:00-04:00,2026-05-27,237990,,https://sam.gov/workspace/contract/opp/2530ec9289e049acb028d857b36cc48e/view,Presolicitation,2026-07-11,OFFICE,014.1443.140P54,Yes,"INTERIOR, DEPARTMENT OF THE.NATIONAL PARK SERVICE.SER SOUTH MABO (54000)",237990,WOSB,,
Solicitation,Crack and Fog Sealing Multiple Locations,Not Specified,,$45M,140P6426Q0073,,Total Small Business Set-Aside (FAR 19.5),2026-06-25T12:00:00-04:00,2026-05-20,237310,,https://sam.gov/workspace/contract/opp/83e009c5b2e94106a314dd7d1f30a0b3/view,Presolicitation,2026-09-30,OFFICE,014.1443.140P64,Yes,"INTERIOR, DEPARTMENT OF THE.NATIONAL PARK SERVICE.MWR OHIO(64000)",237310,SBA,,
Solicitation,"Repair and Widen Taxiways Phase III, PSTE 162013",Not Specified,,"$10,000,000.00 and $25,000,000.00 | $45,000,000.00 | $10,000,000.00",W50S9526BA002,,Total Small Business Set-Aside (FAR 19.5),2026-06-23T14:00:00-04:00,2026-05-19,237310,,https://sam.gov/workspace/contract/opp/a62ceb14c4b3438ba7e7905900fc2f09/view,Solicitation,2027-05-19,OFFICE,021.2100.NGB.JFHQ USPFO SC.USPFO SC PROC.W50S95,Yes,DEPT OF DEFENSE.DEPT OF THE ARMY.NATIONAL GUARD BUREAU.JFHQ USPFO SC.USPFO SC PROCUREMENT.W7NZ USPFO ACTIVITY SCANG 169,237310,SBA,,
Solicitation,"Fort Sam Houston National Cemetery, Phase 3 Expansion - Additional Road Repairs","San Antonio, Texas",,"$1,000,000 and $2,000,000 | $1,000,000 | $2,000,000",36C10F26B0001,,Service-Disabled Veteran-Owned Small Business Set Aside,2026-06-30T14:00:00-04:00,2026-05-28,237310,,https://sam.gov/workspace/contract/opp/bdf7be79b5194995a86699c576002b5a/view,Presolicitation,2026-07-15,OFFICE,036.3600.36C10F,Yes,"VETERANS AFFAIRS, DEPARTMENT OF.VETERANS AFFAIRS, DEPARTMENT OF.OFFICE OF CONSTRUCTION &  FACILITIES MGMT (36C10F)",237310,SDVOSBC,,"['https://sam.gov/api/prod/opps/v3/opportunities/resources/files/10e75a06da654900928bbc101b5d197e/download', 'https://sam.gov/api/prod/opps/v3/opportunities/resources/files/2bf70e9e8da243a08be7ee436fd953de/download', 'https://sam.gov/api/prod/opps/v3/opportunities/resources/files/5ef66ac42ee949e5832749540d67ea95/download', 'https://sam.gov/api/prod/opps/v3/opportunities/resources/files/a1a4702f4c5b4237982f3e065b0c620e/download', 'https://sam.gov/api/prod/opps/v3/opportunities/resources/files/a670178211474d1390a3d70094af68a0/download', 'https://sam.gov/api/prod/opps/v3/opportunities/resources/files/d3a5dccda8c84f96afb518aee82d80a4/download', 'https://sam.gov/api/prod/opps/v3/opportunities/resources/files/fc5a0306206945c78e84035b0c6b3896/download']"
Solicitation,Marine Corps Base Camp Pendleton (MCBCP) Base Operations Support Contract (BOSC),"Oceanside, California",,$47 Million,N6247324R0036,,Total Small Business Set-Aside (FAR 19.5),2026-06-04T14:00:00-07:00,2026-05-18,561210,{'awardee': {'manual': False}},https://sam.gov/workspace/contract/opp/7d0b3c987ba54e488a91bfed9ffc1cc8/view,Solicitation,2026-06-19,OFFICE,017.1700.NAVFAC.NAVFAC PACIFIC CMD.NAVFAC SW.N62473,Yes,DEPT OF DEFENSE.DEPT OF THE NAVY.NAVFAC.NAVFAC PACIFIC CMD.NAVFAC SOUTHWEST SW.NAVFACSYSCOM SOUTHWEST,561210,SBA,,
Solicitation,Facility Maintenance Management and Services,Not Specified,,,N6247326R0039,,Total Small Business Set-Aside (FAR 19.5),2026-05-15T14:00:00-07:00,2026-05-08,561210,,https://sam.gov/workspace/contract/opp/5eff9b9932dd4a1f9421c750318a2850/view,Solicitation,2027-05-08,OFFICE,017.1700.NAVFAC.NAVFAC PACIFIC CMD.NAVFAC SW.N62473,Yes,DEPT OF DEFENSE.DEPT OF THE NAVY.NAVFAC.NAVFAC PACIFIC CMD.NAVFAC SOUTHWEST SW.NAVFACSYSCOM SOUTHWEST,561210,SBA,,['https://sam.gov/api/prod/opps/v3/opportunities/resources/files/43d413d0c4f44852843c447b72b45ee3/download']
Solicitation,Z--Steel Pole Foundations IDIQ UGP/RMR,Not Specified,,,89503426BWA000064,,Total Small Business Set-Aside (FAR 19.5),2026-05-20T16:00:00-05:00,2026-05-12,237130,,https://sam.gov/workspace/contract/opp/d1b838eb4c604737b79c1c17d0abfc0a/view,Solicitation,2026-06-04,OFFICE,089.8900.895034,Yes,"ENERGY, DEPARTMENT OF.ENERGY, DEPARTMENT OF.WESTERN-UPPER GREAT PLAINS REGION",237130,SBA,,
Solicitation,63--PEARL - FY26 REPLACEMENT 6 FIRE ALARM PANELS,Not Specified,,,140P8226Q0038,,Total Small Business Set-Aside (FAR 19.5),2026-06-01T14:30:00-04:00,2026-05-27,238210,,https://sam.gov/workspace/contract/opp/a87e21f836f44d689865607ca1dc7328/view,Solicitation,2026-06-16,OFFICE,014.1443.140P97,Yes,"INTERIOR, DEPARTMENT OF THE.NATIONAL PARK SERVICE.ALASKA REGIONAL OFFICE(97000)",238210,SBA,,
Solicitation,Parachute/ Airborne Boat and Dive Operations Services,"Camp Lejeune, North Carolina",,,M6700126Q0052,,Total Small Business Set-Aside (FAR 19.5),2026-05-20T13:00:00-04:00,2026-05-13,561210,,https://sam.gov/workspace/contract/opp/d947ee5b1b1e4ed0ac4ff6bf6bf5d091/view,Solicitation,2026-06-04,OFFICE,017.1700.USMC.MARCORP I&L.MCICOM.MCIEAST.M67001,Yes,DEPT OF DEFENSE.DEPT OF THE NAVY.USMC.MARCORP I&L.MARINE CORPS INSTALLATIONS COMMAND.MCIEAST.COMMANDING GENERAL,561210,SBA,,"['https://sam.gov/api/prod/opps/v3/opportunities/resources/files/1f79951d3cef4165a1c99e823e449e8e/download', 'https://sam.gov/api/prod/opps/v3/opportunities/resources/files/4988754153f24605b9d651ced4f85901/download']"
Solicitation,Dorm Receptacles,"Goldsboro, North Carolina",,,FA480926Q0030,,Total Small Business Set-Aside (FAR 19.5),2026-05-21T10:00:00-04:00,2026-05-15,238210,,https://sam.gov/workspace/contract/opp/cbbc1fe702e842b8b5cb8a8de504d25b/view,Solicitation,2026-06-05,OFFICE,057.5700.ACC.FA4809,Yes,DEPT OF DEFENSE.DEPT OF THE AIR FORCE.AIR COMBAT COMMAND.FA4809  4TH CONS SQ CC,238210,SBA,,
Solicitation,LTUY252022 Repair B37 MTS by Removal,"Saint Louis, Missouri",,,W50S8K26QA001,,Total Small Business Set-Aside (FAR 19.5),2026-05-27T10:00:00-05:00,2026-05-20,238210,,https://sam.gov/workspace/contract/opp/2d1da85a60d14f109bfc5572f9c5593a/view,Solicitation,2026-06-11,OFFICE,021.2100.NGB.JFHQ USPFO MO.USPFO MO PROC.W50S8K,Yes,DEPT OF DEFENSE.DEPT OF THE ARMY.NATIONAL GUARD BUREAU.JFHQ USPFO MO.USPFO MO PROCUREMENT.W7NJ USPFO ACTIVITY MOANG 131,238210,SBA,,
Solicitation,B-52J Commercial Engine Replacement Program Airfield Runway/Taxiway Light Removal and Replacement,"DWG, Texas",,,FA301626Q0118,,Total Small Business Set-Aside (FAR 19.5),2026-06-05T11:00:00-05:00,2026-05-29,238210,,https://sam.gov/workspace/contract/opp/7a4aeccfe4c24c63967c0d0a374425a6/view,Solicitation,2026-06-20,OFFICE,057.5700.AETC.JBSA.FA3016,Yes,DEPT OF DEFENSE.DEPT OF THE AIR FORCE.AIR EDUCATION AND TRAINING COMMAND.JOINT BASE SAN ANTONIO.FA3016  502 CONS CL,238210,SBA,,"['https://sam.gov/api/prod/opps/v3/opportunities/resources/files/4639ff31a9134d559e3e3fec4f7b165d/download', 'https://sam.gov/api/prod/opps/v3/opportunities/resources/files/8526a8c54c25430b9c558569bf7f1a87/download', 'https://sam.gov/api/prod/opps/v3/opportunities/resources/files/8b1ac5b5b96747b8b5cb58109b5c2b5a/download', 'https://sam.gov/api/prod/opps/v3/opportunities/resources/files/c7e05e080bd74f68ab7ab079bc8873e9/download', 'https://sam.gov/api/prod/opps/v3/opportunities/resources/files/d874443d50244784b38019f4199ffc95/download', 'https://sam.gov/api/prod/opps/v3/opportunities/resources/files/f7a4488348c2438f914b70f0177197cf/download']"
Solicitation,N--GC26 SCADA UPS REPLACEMENT,Not Specified,,,140R4026R0006,,Total Small Business Set-Aside (FAR 19.5),2026-05-26T07:00:00-04:00,2026-05-11,238210,,https://sam.gov/workspace/contract/opp/968b8fbc09ec4feebd31083ee8e43694/view,Solicitation,2026-06-10,OFFICE,014.1425.140R40,Yes,"INTERIOR, DEPARTMENT OF THE.BUREAU OF RECLAMATION.UPPER COLORADO REGIONAL OFFICE",238210,SBA,,"['https://sam.gov/api/prod/opps/v3/opportunities/resources/files/03df14b34ac34dc4bd7630b17d217f66/download', 'https://sam.gov/api/prod/opps/v3/opportunities/resources/files/145a7134ce6c47fb93344c1bc2f1dc3b/download', 'https://sam.gov/api/prod/opps/v3/opportunities/resources/files/268f24a8f3b8462ab2de2c24e5b71ea5/download', 'https://sam.gov/api/prod/opps/v3/opportunities/resources/files/468c53eaf7b84ce084ef15114cb6c836/download', 'https://sam.gov/api/prod/opps/v3/opportunities/resources/files/4888f13aa5614e9c9654ab39288286d7/download', 'https://sam.gov/api/prod/opps/v3/opportunities/resources/files/4e1137c8b66345c39ffe03f2be452827/download', 'https://sam.gov/api/prod/opps/v3/opportunities/resources/files/5a870e531ccd4244918bb2a95c02a21a/download', 'https://sam.gov/api/prod/opps/v3/opportunities/resources/files/6bcf0af746464a26a53b226f2d0e9341/download', 'https://sam.gov/api/prod/opps/v3/opportunities/resources/files/7fb501cdfd584545b06a1e6703989a14/download', 'https://sam.gov/api/prod/opps/v3/opportunities/resources/files/829662b802a241a2bcb52ec42eac9a96/download', 'https://sam.gov/api/prod/opps/v3/opportunities/resources/files/8c008aba4c0044f3aeec8f67d6bb6493/download', 'https://sam.gov/api/prod/opps/v3/opportunities/resources/files/a0a93c3e3e354ab19ebbfc0be1ebc5dc/download', 'https://sam.gov/api/prod/opps/v3/opportunities/resources/files/a190c61556bf46609f49f30d97ce6d44/download', 'https://sam.gov/api/prod/opps/v3/opportunities/resources/files/b19b6209e799420db145de312e0b470c/download', 'https://sam.gov/api/prod/opps/v3/opportunities/resources/files/bb68df96f3cc47c4b5f7fb26ba25a980/download', 'https://sam.gov/api/prod/opps/v3/opportunities/resources/files/e3ed07714bee4753b8aa4a3c075930a5/download', 'https://sam.gov/api/prod/opps/v3/opportunities/resources/files/ebadd86dfe45434da4a3142464208565/download', 'https://sam.gov/api/prod/opps/v3/opportunities/resources/files/fe3408325b5f48a1a477851fa79b8041/download']"
Solicitation,"Base Operations Support (BOS) Maintenance and Service Contract for Naval Air Facility (NAF), El Centro, CA",Not Specified,,,N6247326R0012,,Total Small Business Set-Aside (FAR 19.5),2026-06-03T14:00:00-07:00,2026-05-27,561210,,https://sam.gov/workspace/contract/opp/98a21ee39cca43fe9e4c197080602320/view,Solicitation,2027-05-27,OFFICE,017.1700.NAVFAC.NAVFAC PACIFIC CMD.NAVFAC SW.N62473,Yes,DEPT OF DEFENSE.DEPT OF THE NAVY.NAVFAC.NAVFAC PACIFIC CMD.NAVFAC SOUTHWEST SW.NAVFACSYSCOM SOUTHWEST,561210,SBA,,
Solicitation,Y--LAKE - TWO COMMUNICATIONS TOWER INSTALLATION AND O,Not Specified,,,140P8126B0003,,Total Small Business Set-Aside (FAR 19.5),2026-06-03T14:00:00-07:00,2026-05-12,237130,,https://sam.gov/workspace/contract/opp/eb9720adecc64a7abaa7b370c533c314/view,Solicitation,2026-06-18,OFFICE,014.1443.140P81,Yes,"INTERIOR, DEPARTMENT OF THE.NATIONAL PARK SERVICE.PWR LAME(81000)",237130,SBA,,"['https://sam.gov/api/prod/opps/v3/opportunities/resources/files/47d0a120247d40189b3e4baf3093b713/download', 'https://sam.gov/api/prod/opps/v3/opportunities/resources/files/493c7b89582949f0a624e47aecaf2324/download', 'https://sam.gov/api/prod/opps/v3/opportunities/resources/files/4c7d665fd4a745e4bda659506b28b536/download', 'https://sam.gov/api/prod/opps/v3/opportunities/resources/files/6b4de4ffa7c24b4c811e9f16a153ca79/download', 'https://sam.gov/api/prod/opps/v3/opportunities/resources/files/8389225186ed4722b93ae7504a31eb95/download', 'https://sam.gov/api/prod/opps/v3/opportunities/resources/files/a148a407b9cd4a34b8ad86702ad6c1a6/download', 'https://sam.gov/api/prod/opps/v3/opportunities/resources/files/df05231d619c4eff87b22b8430b6428a/download', 'https://sam.gov/api/prod/opps/v3/opportunities/resources/files/f24f56ea7dae4c578782c7ea71409148/download']"
Solicitation,99CES - PKA - WT16747339 - Install Lift Station Disconnect B1730,Not Specified,,,FA486126Q0010,,Total Small Business Set-Aside (FAR 19.5),2026-06-03T14:00:00-07:00,2026-05-28,238210,,https://sam.gov/workspace/contract/opp/45614b4595a04e7eb4447dcf0dbcb028/view,Solicitation,2027-05-28,OFFICE,057.5700.ACC.FA4861,Yes,DEPT OF DEFENSE.DEPT OF THE AIR FORCE.AIR COMBAT COMMAND.FA4861  99 CONS LGC,238210,SBA,,
Solicitation,"Z--FOLS, Replace Alarm System & Electrical Panel","Larned, Kansas",,,140P6026Q0042,,Total Small Business Set-Aside (FAR 19.5),2026-06-04T12:00:00-05:00,2026-05-14,238210,,https://sam.gov/workspace/contract/opp/93bf630bd3854ab1af97bf2513d05041/view,Solicitation,2026-06-19,OFFICE,014.1443.140P60,Yes,"INTERIOR, DEPARTMENT OF THE.NATIONAL PARK SERVICE.MWR MIDWEST REGION(60000)",238210,SBA,,"['https://sam.gov/api/prod/opps/v3/opportunities/resources/files/72a94a3ddda048b9a10072d7b5cdaa22/download', 'https://sam.gov/api/prod/opps/v3/opportunities/resources/files/8282eee778014dd3991755a0121b06ff/download', 'https://sam.gov/api/prod/opps/v3/opportunities/resources/files/94b0939e209346c4bf05c96f655fb74b/download', 'https://sam.gov/api/prod/opps/v3/opportunities/resources/files/e71a52d4fddf4dd59125e0ad78477f57/download', 'https://sam.gov/api/prod/opps/v3/opportunities/resources/files/e9a7a57ab442463da5faf2d2b809393d/download']"
Solicitation,Fiber Optic Cable B230 to B9511,Mississippi,,,FA302226Q0009,,Total Small Business Set-Aside (FAR 19.5),2026-06-12T10:00:00-05:00,2026-05-26,238210,,https://sam.gov/workspace/contract/opp/c26d564110a44cdc9bf5752b5371c451/view,Solicitation,2026-06-27,OFFICE,057.5700.AETC.FA3022,Yes,DEPT OF DEFENSE.DEPT OF THE AIR FORCE.AIR EDUCATION AND TRAINING COMMAND.FA3022 14 CONS LGCA,238210,SBA,,
Solicitation,FY26 TCS MITD Enterprise Classroom Modernization Facilitator Support,Not Specified,,,W911S026QA004,,Service-Disabled Veteran-Owned Small Business Set Aside,2026-06-08T15:00:00-05:00,2026-05-28,561210,,https://sam.gov/workspace/contract/opp/855f8cf0aa2c47e088fc7673bff5cf70/view,Solicitation,2027-05-28,OFFICE,021.2100.AMC.ACC.MICC.FDO EUSTIS.W911S0,Yes,DEPT OF DEFENSE.DEPT OF THE ARMY.AMC.ACC.MISSION INSTALLATION CONTRACTING COMMAND.FDO EUSTIS.W6QM MICC-FDO FT EUSTIS,561210,SDVOSBC,,"['https://sam.gov/api/prod/opps/v3/opportunities/resources/files/6436e2f37a73460eb69ed11370954554/download', 'https://sam.gov/api/prod/opps/v3/opportunities/resources/files/83a86923bba8455e9ae3c0a8321848fc/download', 'https://sam.gov/api/prod/opps/v3/opportunities/resources/files/ad4b179272b94618afb51c481b112bbb/download', 'https://sam.gov/api/prod/opps/v3/opportunities/resources/files/e006a09ad12f4a08a2ef4c295daf5ffe/download', 'https://sam.gov/api/prod/opps/v3/opportunities/resources/files/e3b673bf33044cb7843ece93463939ec/download', 'https://sam.gov/api/prod/opps/v3/opportunities/resources/files/e768fc7e7fc6483187d147cac20088d0/download']"
Solicitation,Z--Verona-Great Falls 161KV Transmission Line Rebuild,Not Specified,,,89503426BWA000065,,Total Small Business Set-Aside (FAR 19.5),2026-06-15T15:30:00-05:00,2026-06-02,237130,,https://sam.gov/workspace/contract/opp/74f7a37dc0df42658c9a2b914e3e7b42/view,Solicitation,2026-06-30,OFFICE,089.8900.895034,Yes,"ENERGY, DEPARTMENT OF.ENERGY, DEPARTMENT OF.WESTERN-UPPER GREAT PLAINS REGION",237130,SBA,,
Solicitation,Z2DA--519-20-200 VABS Replace Boiler Plant Solicitation 36C25726B0006,"Big Spring, Texas",,,36C25726B0006,,Service-Disabled Veteran-Owned Small Business Set Aside,2026-06-16T10:00:00-05:00,2026-05-21,237130,,https://sam.gov/workspace/contract/opp/d45a084a5c254e4e9d892c5fc641d479/view,Solicitation,2026-07-01,OFFICE,036.3600.36C257,Yes,"VETERANS AFFAIRS, DEPARTMENT OF.VETERANS AFFAIRS, DEPARTMENT OF.257-NETWORK CONTRACT OFFICE 17 (36C257)",237130,SDVOSBC,,
Solicitation, Base Operations Support (BOS) Services at Naval Air Station (NAS) Whiting Field and Outlying Areas,Not Specified,,,N6945026R0064,,Total Small Business Set-Aside (FAR 19.5),2026-06-17T14:00:00-04:00,2026-06-01,561210,,https://sam.gov/workspace/contract/opp/de844d5ae65040e3b4d90dd56d37a295/view,Solicitation,2027-06-01,OFFICE,017.1700.NAVFAC.NAVFAC ATLANTIC CMD.NAVFAC SOUTHEAST.N69450,Yes,DEPT OF DEFENSE.DEPT OF THE NAVY.NAVFAC.NAVFAC ATLANTIC CMD.NAVFAC SOUTHEAST.NAVFACSYSCOM SOUTHEAST,561210,SBA,,
Solicitation,Anniston Army Depot (ANAD) Power Generation and Microgrid Project,"Anniston, Alabama",,,W912QR26RA033,,Service-Disabled Veteran-Owned Small Business Set Aside,2026-06-29T14:00:00-04:00,2026-05-21,237130,,https://sam.gov/workspace/contract/opp/2b46f2a95df24cd999eb1c10781149b5/view,Solicitation,2026-07-14,OFFICE,021.2100.USACE.LRD.LRL.W912QR,Yes,DEPT OF DEFENSE.DEPT OF THE ARMY.US ARMY CORPS OF ENGINEERS.ENGINEER DIVISION GREAT LAKES AND OHIO.ENDIST LOUISVILLE.W072 ENDIST LOUISVILLE,237130,SDVOSBC,,
Special Notice,Special Notice: Forthcoming Solicitation for Building Control System (BCS) and Utility Control System (UCS) Maintenance and Support Services,Not Specified,,,SP470525R002026,,Total Small Business Set-Aside (FAR 19.5),2026-06-30T14:00:00-04:00,2026-05-13,561210,,https://sam.gov/workspace/contract/opp/d16a10f2aae140ed8a4e9cda6e6aedfc/view,Special Notice,2026-07-15,MAJOR COMMAND,097.97AS.DCSO,Yes,DEPT OF DEFENSE.DEFENSE LOGISTICS AGENCY.DCSO,561210,SBA,,
Presolicitation,178th Wing Base Microgrid Construction,"Springfield, Ohio",,"$5,000,000 and $10,000,000 | $45,000,000 | $5,000,000",WAAR209001,,Total Small Business Set-Aside (FAR 19.5),2026-06-01T16:00:00-04:00,2026-05-15,237130,,https://sam.gov/workspace/contract/opp/220298d38ef045708cfa78346ed2dc5e/view,Presolicitation,2026-06-16,OFFICE,021.2100.NGB.JFHQ USPFO OH.USPFO OH PROC.W50S8Q,Yes,DEPT OF DEFENSE.DEPT OF THE ARMY.NATIONAL GUARD BUREAU.JFHQ USPFO OH.USPFO OH PROCUREMENT.W7NU USPFO ACTIVITY OHANG 178,237130,SBA,,
Presolicitation,"J061--PROJECT 675-25-804, Bid-Build (BB) Install Water Tower  Projector System at Lake Nona","Orlando, Florida",,,36C24826R0107,,Service-Disabled Veteran-Owned Small Business Set Aside,2026-06-15T11:00:00-04:00,2026-05-28,238210,{'awardee': {}},https://sam.gov/workspace/contract/opp/3372c74b2b3240c5bf7028e6312a3691/view,Presolicitation,2026-09-22,OFFICE,036.3600.36C248,Yes,"VETERANS AFFAIRS, DEPARTMENT OF.VETERANS AFFAIRS, DEPARTMENT OF.248-NETWORK CONTRACT OFFICE 8 (36C248)",238210,SDVOSBC,,"['https://sam.gov/api/prod/opps/v3/opportunities/resources/files/082ac47643b143a48a936068acbdff95/download', 'https://sam.gov/api/prod/opps/v3/opportunities/resources/files/0daf3e829f7c47e8a9875d1bc7722235/download', 'https://sam.gov/api/prod/opps/v3/opportunities/resources/files/0ef48a6b035640f0836998ed1954aee6/download', 'https://sam.gov/api/prod/opps/v3/opportunities/resources/files/306c77ef390b47c48ed23a373cb48174/download', 'https://sam.gov/api/prod/opps/v3/opportunities/resources/files/3bafccda0f16407e9dcbac4d3ba8d4a7/download', 'https://sam.gov/api/prod/opps/v3/opportunities/resources/files/4e68aa453c4d462ca78e72f63d2e848a/download', 'https://sam.gov/api/prod/opps/v3/opportunities/resources/files/61b5ef0ed280481bba31d7c0c6353223/download', 'https://sam.gov/api/prod/opps/v3/opportunities/resources/files/68f8fb29258a44e08f3b6d34b8aeb0cd/download', 'https://sam.gov/api/prod/opps/v3/opportunities/resources/files/8b9394163ec547b19967eb6c389db26c/download', 'https://sam.gov/api/prod/opps/v3/opportunities/resources/files/c8c8ea1838fa4c22b5a0360da65f5f68/download']"
Solicitation,"Cottonwood Substation Construction, Stage 02, Phas",Not Specified,,,89503326BWA000019,,Total Small Business Set-Aside (FAR 19.5),2026-07-06T15:00:00-07:00,2026-06-02,237130,,https://sam.gov/workspace/contract/opp/253b0b4b621a4fd5b2bba90f45463868/view,Presolicitation,2026-07-21,OFFICE,089.8900.895033,Yes,"ENERGY, DEPARTMENT OF.ENERGY, DEPARTMENT OF.WESTERN-SIERRA NEVADA REGION",237130,SBA,,
Presolicitation,Electrical,"Richmond, Kentucky",,$19M,W519TC26R2024,,Total Small Business Set-Aside (FAR 19.5),2026-05-28T04:00:00-04:00,2026-05-12,238210,,https://sam.gov/workspace/contract/opp/bfeb7541a3eb4e679b0b7113a054de5c/view,Presolicitation,2026-06-12,OFFICE,021.2100.W22G1F,Yes,DEPT OF DEFENSE.DEPT OF THE ARMY.W0L7 BLUE GRASS ARMY DEPOT,238210,SBA,,
Presolicitation,J059--Triennial Electical Panel Maintenance and Survey,Not Specified,,,36C25226Q0359,,Total Small Business Set-Aside (FAR 19.5),2026-06-10T06:00:00-05:00,2026-05-14,238210,{'awardee': {}},https://sam.gov/workspace/contract/opp/7bfe99dd287d4db79cbfcaaa2eb19e36/view,Presolicitation,2026-08-09,OFFICE,036.3600.36C252,Yes,"VETERANS AFFAIRS, DEPARTMENT OF.VETERANS AFFAIRS, DEPARTMENT OF.252-NETWORK CONTRACT OFFICE 12 (36C252)",238210,SBA,,['https://sam.gov/api/prod/opps/v3/opportunities/resources/files/797e508f80f44d2b92282f030f0af6ec/download']
Solicitation,Carpenter Substation Stage 03 South Dakota,Not Specified,,,89503426BWA000066,,Total Small Business Set-Aside (FAR 19.5),2026-06-26T15:30:00-05:00,2026-05-26,237130,,https://sam.gov/workspace/contract/opp/42c80e14a2284ef6bf65ccf297972ad8/view,Presolicitation,2026-07-11,OFFICE,089.8900.895034,Yes,"ENERGY, DEPARTMENT OF.ENERGY, DEPARTMENT OF.WESTERN-UPPER GREAT PLAINS REGION",237130,SBA,,
Solicitation,"Denison Substation Stage 10, Iowa",Not Specified,,,89503426BWA000067,,Total Small Business Set-Aside (FAR 19.5),2026-06-29T15:30:00-05:00,2026-05-28,237130,,https://sam.gov/workspace/contract/opp/2a6188f892304b57a8208f6da244ab97/view,Presolicitation,2026-07-14,OFFICE,089.8900.895034,Yes,"ENERGY, DEPARTMENT OF.ENERGY, DEPARTMENT OF.WESTERN-UPPER GREAT PLAINS REGION",237130,SBA,,
Presolicitation,Y1DA--CON Project 674A4-21-108 - Upgrade Fire Alarm  System Campus Wide  (Waco) (VA-25-00021609),"Waco, Texas",,"$5,000,000,000 and $10,000,000 | $19 M | $5,000,000,000",36C25726B0007,,Service-Disabled Veteran-Owned Small Business Set Aside,,2026-05-15,238210,{'awardee': {}},https://sam.gov/workspace/contract/opp/634800be6f2942bfa32758b01d7fc8c0/view,Presolicitation,2026-06-10,OFFICE,036.3600.36C257,Yes,"VETERANS AFFAIRS, DEPARTMENT OF.VETERANS AFFAIRS, DEPARTMENT OF.257-NETWORK CONTRACT OFFICE 17 (36C257)",238210,SDVOSBC,,
Solicitation,Z--WATER TOWER REFURBISHMENT,Not Specified,,$45.0 million,140G0126Q0123,,Total Small Business Set-Aside (FAR 19.5),2026-05-27T10:00:00-07:00,2026-05-21,237110,,https://sam.gov/workspace/contract/opp/2674335730314335a54b832810b5b862/view,Solicitation,2026-06-11,OFFICE,014.1434.140G01,Yes,"INTERIOR, DEPARTMENT OF THE.US GEOLOGICAL SURVEY.OFC OF ACQUSITION  GRANTS-NATIONAL",237110,SBA,,
Solicitation,"Weeks Brook Bridge Railing Repair, Franklin Falls Dam, Sanbornton, NH",Not Specified,,"$25,000 and $100,000 | $25,000 | $100,000",W912WJ26QA100,,Total Small Business Set-Aside (FAR 19.5),2026-06-08T17:00:00-04:00,2026-06-02,237310,,https://sam.gov/workspace/contract/opp/1146e0e57d90422097c9fe8ad4a6a15b/view,Solicitation,2026-06-23,OFFICE,021.2100.USACE.NAD.NAE.W912WJ,Yes,DEPT OF DEFENSE.DEPT OF THE ARMY.US ARMY CORPS OF ENGINEERS.ENGINEER DIVISION NORTH ATLANTIC.ENDIST NEW ENGLAND.W2SD ENDIST NEW ENGLAND,237310,SBA,,
Solicitation,USDA NRCS-Ohio EWP Green Township - Blessing Road,"Patriot, Ohio",,,12FPC326B0003,,Total Small Business Set-Aside (FAR 19.5),2026-05-19T13:00:00-04:00,2026-05-18,237990,,https://sam.gov/workspace/contract/opp/61c1c115e72645fa896388ce49b09659/view,Solicitation,2026-06-03,OFFICE,012.12D0.12FPAC,Yes,"AGRICULTURE, DEPARTMENT OF.FARM PRODUCTION AND CONSERVATION BUSINESS CENTER.FPAC BUS CNTR-ACQ DIV",237990,SBA,,
Solicitation,RFQ 6923G226Q000016 Yocum Sailing removal & installation,"Kings Point, New York",,,6323G226Yocum,,Total Small Business Set-Aside (FAR 19.5),2026-05-26T14:00:00-04:00,2026-05-19,237120,,https://sam.gov/workspace/contract/opp/959f49eff3c24de6987410eb37827a40/view,Solicitation,2026-12-12,OFFICE,069.6938.693JF7,Yes,"TRANSPORTATION, DEPARTMENT OF.MARITIME ADMINISTRATION.693JF7 DOT  MARITIME ADMINISTRATION",237120,SBA,,
